{
  "$schema": "https://spec.xihanfun.com/manifest/v1.json",
  "id": "xihan.samples.echo",
  "package": "EchoPlugin",
  "version": "5.0.0-preview.1",
  "primitives": "1",
  "stability": "experimental",
  "kind": "plugin",
  "isolation": "out-of-process",
  "requires": [ { "id": "kernel.plugins", "version": "1" } ],
  "contributes": {
    "operations": [ "echoes.create", "echoes.relay", "echoes.crash", "events.list" ],
    "config": { "section": "XiHan:Echo" },
    "health": [ "echo" ]
  },
  "permissions": [ "capability:kernel.pipeline" ],
  "activation": [ "onStartup" ],
  "entry": "EchoPlugin"
}
