{
  "$schema": "https://spec.xihanfun.com/manifest/v1.json",
  "id": "xihan.samples.echowasm",
  "package": "EchoWasmPlugin",
  "version": "5.0.0-preview.1",
  "primitives": "1",
  "stability": "experimental",
  "kind": "plugin",
  "isolation": "wasm",
  "requires": [ { "id": "kernel.plugins", "version": "1" } ],
  "contributes": {
    "pipeline": [ { "middleware": "echo-guard", "stage": "observe" } ],
    "operations": [ "echoes.create", "echoes.relay", "echoes.trap", "echoes.spin", "events.list" ],
    "config": { "section": "XiHan:Echo" },
    "health": [ "echo" ]
  },
  "permissions": [ "capability:kernel.pipeline" ],
  "activation": [ "onStartup" ],
  "entry": "echo.wasm"
}
